{
  "message_id": "019fbdd7-1000-7000-8000-000000000001",
  "message_kind": "event",
  "contract_name": "TaskCompleted",
  "contract_version": "1.0",
  "created_at": "2026-08-01T12:00:01Z",
  "correlation_id": "019fbdd6-ab3d-77aa-8e61-4c3a4e21ad64",
  "causation_id": "019fbdd6-ab3d-77aa-8e61-4c40d234a3bf",
  "workflow_id": "019fbdd6-ab3d-77aa-8e61-4c3bc6d53f69",
  "task_id": "019fbdd6-ab3d-77aa-8e61-4c41f9f4f1a1",
  "task_attempt_id": "019fbdd6-ab3d-77aa-8e61-4c425fab5f4b",
  "producer": {
    "component": "test-agent",
    "instance_id": "019fbdd6-ab3d-77aa-8e61-4c442e87c74c"
  },
  "payload": {
    "text": "the quick brown fox jumps over the lazy dog",
    "result": { "word_count": 9 },
    "completed_at": "2026-08-01T12:00:01Z",
    "capability": "text.word-count",
    "capability_version": "1.0",
    "agent": {
      "component": "test-agent",
      "instance_id": "019fbdd6-ab3d-77aa-8e61-4c442e87c74c"
    }
  }
}
